{
  "registry_id": "cognitive_architecture_demo.projected_terms",
  "registry_version": "0.2.0",
  "target_ontology": "cognitive_architecture_demo.v0",
  "terms": {
    "abstraction_exploration_mode": {
      "term_type": "mode",
      "canonical_label": "Abstraction Exploration Mode",
      "friendly_labels": [
        "abstraction exploration mode"
      ],
      "short_description": "An operating style characterized by abstraction exploration mode.",
      "long_description": "This mode describes how a projected operator tends to perform its function: through abstraction exploration mode. It modifies the operator rather than replacing it.",
      "core_operators": [],
      "semantic_facets": [
        "abstraction",
        "exploration",
        "mode"
      ],
      "related_terms": [],
      "output_guidance": {
        "adverbial_phrase": "in a abstraction exploration mode style",
        "verb_phrase": "operates through abstraction exploration mode",
        "composition_template": "{operator_phrase} operates {adverbial_phrase}."
      },
      "extensions": {
        "authorship": "profile_level",
        "prescriptive": false
      }
    },
    "abstraction_worldview_long_range_learning": {
      "term_type": "domain",
      "canonical_label": "Abstraction Worldview Long Range Learning",
      "friendly_labels": [
        "abstraction worldview long range learning"
      ],
      "short_description": "A projected context or life domain centered on abstraction worldview long range learning.",
      "long_description": "This domain describes where the projected operator is organized or expressed, with abstraction worldview long range learning providing the structural context.",
      "core_operators": [],
      "semantic_facets": [
        "abstraction",
        "learning",
        "long",
        "range",
        "worldview"
      ],
      "related_terms": [],
      "output_guidance": {
        "context_phrase": "within the domain of abstraction worldview long range learning",
        "location_phrase": "in abstraction worldview long range learning",
        "composition_template": "{operator_phrase} is organized {context_phrase}."
      },
      "extensions": {
        "authorship": "profile_level",
        "prescriptive": false
      }
    },
    "action_selection": {
      "term_type": "operator",
      "canonical_label": "Action Selection",
      "friendly_labels": [
        "action selection"
      ],
      "short_description": "A projected operator describing action selection.",
      "long_description": "This term represents the target-ontology function of action selection. It should be read as an active subsystem or interface whose core verbs are preserved by the projection profile.",
      "core_operators": [
        "assert",
        "defend",
        "mobilize",
        "select_action"
      ],
      "semantic_facets": [
        "action_selection",
        "boundary_response",
        "effort_allocation"
      ],
      "related_terms": [],
      "output_guidance": {
        "noun_phrase": "action selection",
        "possessive_phrase": "the subject's action selection",
        "subject_template": "{subject}'s action selection",
        "composition_template": "{subject_phrase} operates {mode_phrase} {domain_phrase}."
      },
      "extensions": {
        "authorship": "profile_level",
        "prescriptive": false
      }
    },
    "active_interface": {
      "term_type": "interface",
      "canonical_label": "Active Interface",
      "friendly_labels": [
        "active interface"
      ],
      "short_description": "A projected interface describing active interface.",
      "long_description": "This term represents the target-ontology function of active interface. It should be read as an active subsystem or interface whose core verbs are preserved by the projection profile.",
      "core_operators": [
        "initiate_response",
        "interface",
        "present"
      ],
      "semantic_facets": [
        "first_response_policy",
        "system_boundary"
      ],
      "related_terms": [],
      "output_guidance": {
        "noun_phrase": "active interface",
        "possessive_phrase": "the subject's active interface",
        "subject_template": "{subject}'s active interface",
        "composition_template": "{subject_phrase} operates {mode_phrase} {domain_phrase}."
      },
      "extensions": {
        "authorship": "profile_level",
        "prescriptive": false
      }
    },
    "adjacent_low_bandwidth_coordination": {
      "term_type": "relation",
      "canonical_label": "Adjacent Low Bandwidth Coordination",
      "friendly_labels": [
        "adjacent low bandwidth coordination"
      ],
      "short_description": "A projected relationship in which two subsystems adjacent low bandwidth coordination.",
      "long_description": "This relation describes how two projected endpoints interact: they adjacent low bandwidth coordination. It preserves source relationship geometry while expressing the interaction in target-domain language.",
      "core_operators": [
        "adjacent_signal",
        "incrementally_adjust",
        "weakly_coordinate"
      ],
      "semantic_facets": [
        "low_bandwidth_adjacency"
      ],
      "related_terms": [],
      "output_guidance": {
        "verb_phrase": "adjacent low bandwidth coordination",
        "sentence_template": "{source_phrase} adjacent low bandwidth coordination {target_phrase}.",
        "composition_template": "{source_phrase} {verb_phrase} {target_phrase}."
      },
      "extensions": {
        "authorship": "profile_level",
        "prescriptive": false
      }
    },
    "associative_permeable_integration_mode": {
      "term_type": "mode",
      "canonical_label": "Associative Permeable Integration Mode",
      "friendly_labels": [
        "associative permeable integration mode"
      ],
      "short_description": "An operating style characterized by associative permeable integration mode.",
      "long_description": "This mode describes how a projected operator tends to perform its function: through associative permeable integration mode. It modifies the operator rather than replacing it.",
      "core_operators": [],
      "semantic_facets": [
        "associative",
        "integration",
        "mode",
        "permeable"
      ],
      "related_terms": [],
      "output_guidance": {
        "adverbial_phrase": "in a associative permeable integration mode style",
        "verb_phrase": "operates through associative permeable integration mode",
        "composition_template": "{operator_phrase} operates {adverbial_phrase}."
      },
      "extensions": {
        "authorship": "profile_level",
        "prescriptive": false
      }
    },
    "available_coordination": {
      "term_type": "theme",
      "canonical_label": "Available Coordination",
      "friendly_labels": [
        "available coordination"
      ],
      "short_description": "A projected semantic theme concerning available coordination.",
      "long_description": "This theme identifies available coordination as a recurring semantic facet in the projected graph.",
      "core_operators": [],
      "semantic_facets": [
        "available",
        "coordination"
      ],
      "related_terms": [],
      "output_guidance": {
        "noun_phrase": "available coordination"
      },
      "extensions": {
        "authorship": "profile_level",
        "prescriptive": false
      }
    },
    "change_adaptation": {
      "term_type": "operator",
      "canonical_label": "Change Adaptation",
      "friendly_labels": [
        "change adaptation"
      ],
      "short_description": "A projected operator describing change adaptation.",
      "long_description": "This term represents the target-ontology function of change adaptation. It should be read as an active subsystem or interface whose core verbs are preserved by the projection profile.",
      "core_operators": [
        "differentiate",
        "disrupt",
        "novelize",
        "update"
      ],
      "semantic_facets": [
        "change_adaptation",
        "model_revision",
        "novelty_detection"
      ],
      "related_terms": [],
      "output_guidance": {
        "noun_phrase": "change adaptation",
        "possessive_phrase": "the subject's change adaptation",
        "subject_template": "{subject}'s change adaptation",
        "composition_template": "{subject_phrase} operates {mode_phrase} {domain_phrase}."
      },
      "extensions": {
        "authorship": "profile_level",
        "prescriptive": false
      }
    },
    "co_activates_and_fuses": {
      "term_type": "relation",
      "canonical_label": "Co Activates And Fuses",
      "friendly_labels": [
        "co activates and fuses"
      ],
      "short_description": "A projected relationship in which two subsystems co activates and fuses.",
      "long_description": "This relation describes how two projected endpoints interact: they co activates and fuses. It preserves source relationship geometry while expressing the interaction in target-domain language.",
      "core_operators": [
        "amplify",
        "co_activate",
        "fuse"
      ],
      "semantic_facets": [
        "shared_activation"
      ],
      "related_terms": [],
      "output_guidance": {
        "verb_phrase": "co activates and fuses",
        "sentence_template": "{source_phrase} co activates and fuses {target_phrase}.",
        "composition_template": "{source_phrase} {verb_phrase} {target_phrase}."
      },
      "extensions": {
        "authorship": "profile_level",
        "prescriptive": false
      }
    },
    "communication_processing": {
      "term_type": "operator",
      "canonical_label": "Communication Processing",
      "friendly_labels": [
        "communication processing"
      ],
      "short_description": "A projected operator describing communication processing.",